{
  "id": "010_cambrian1_prompt_probe",
  "title": "建立 Cambrian-1 受限标签 Prompt Baseline",
  "goal": "使用 Cambrian-1-8B 的多视觉塔能力，在受限 8 类标签集合内做 prompt baseline，观察模型对情绪类别的文本选择偏差。",
  "inputs": [
    "Cambrian-1-8B 模型或等价可运行配置",
    "验证集 CSV：outputs/splits/val.csv",
    "8 类英文标签和固定输出格式 prompt",
    "统一指标函数"
  ],
  "outputs": [
    "src/cambrian1_prompt_probe.py 或等价入口",
    "outputs/reports/cambrian1_prompt_probe_metrics.json",
    "outputs/reports/cambrian1_prompt_details.json",
    "outputs/reports/cambrian1_prompt_confusion_matrix.csv"
  ],
  "acceptance_criteria": [
    "Prompt 明确要求模型只从 8 个合法英文标签中选择一个。",
    "能对验证集输出每张图的预测标签，无法解析的输出必须记录并按失败样本统计。",
    "能用统一指标函数计算 Macro-F1、Accuracy、每类指标和混淆矩阵。",
    "报告记录模型名、prompt 模板、解析规则、失败率和类别文本。",
    "该结果只作为语义观察和辅助 baseline，不被标记为最终唯一提交方案。"
  ],
  "depends_on": [
    "005_dataset_loader",
    "007_metrics_report"
  ],
  "priority": "required",
  "implementation_notes": [
    "为控制成本，可以先在验证集子集上探测，再扩展到完整验证集。",
    "输出解析必须严格，不能把非 8 类文本静默映射到近似标签。",
    "如果 VLM 推理成本过高，保留报告并优先走双塔特征缓存路线。"
  ]
}
