{
  "id": "015_final_inference_package",
  "title": "最终全量推理与提交包生成",
  "goal": "使用门控后的最佳模型对 1391 张测试图片执行最终推理，生成双轨提交文件、映射表和可复查日志。",
  "inputs": [
    "outputs/reports/advanced_strategy_gate.json 或 best_model_manifest.json",
    "最佳 checkpoint",
    "测试目录：configs/default.yaml 中的 test_dir",
    "src/datasets.py 的测试 Dataset",
    "src/submission_writer.py 或等价提交导出接口"
  ],
  "outputs": [
    "outputs/submissions/final/test.txt，按官方确认格式生成的最终提交文件",
    "outputs/submissions/final/test_labels_only.txt",
    "outputs/submissions/final/test_filename_label.txt",
    "outputs/submissions/final/prediction_mapping.csv",
    "outputs/submissions/final/inference_log.json"
  ],
  "acceptance_criteria": [
    "最终推理覆盖 1391 张测试图片。",
    "测试图片读取顺序为数字自然序，从 1.jpg 到 1391.jpg。",
    "所有图片推理前统一转换为 RGB。",
    "全部预测标签都属于 8 个合法英文类别。",
    "最终提交文件为 1391 行，UTF-8 无 BOM，无空行、多余空格或非法字符。",
    "prediction_mapping.csv 能重生成最终提交文件且内容一致。",
    "inference_log.json 记录模型来源、checkpoint 路径、配置摘要、生成时间和提交格式选择。"
  ],
  "depends_on": ["014_advanced_strategy_gate", "008_submission_writer"],
  "priority": "required",
  "implementation_notes": [
    "如果官方最终格式仍有歧义，保留两个版本，并将 final/test.txt 指向用户确认的格式。",
    "最终推理必须使用验证阶段一致的 preprocess。",
    "在提交前重新运行 submission writer 的校验函数，不只依赖文件生成成功。"
  ]
}
