{
  "id": "011_siglip2_feature_cache",
  "title": "缓存冻结 SigLIP 2 图像特征",
  "goal": "冻结 SigLIP 2 图像编码器，为训练集、验证集和测试集批量提取图像特征并缓存，降低分类头训练成本。",
  "inputs": [
    "SigLIP 2 模型与 processor：google/siglip2-so400m-patch16-384",
    "outputs/splits/train.csv",
    "outputs/splits/val.csv",
    "测试 Dataset",
    "批大小、设备和输出目录配置"
  ],
  "outputs": [
    "src/cache_siglip2_features.py 或等价入口",
    "outputs/features/siglip2_so400m_train_features.pt 或 .npy",
    "outputs/features/siglip2_so400m_val_features.pt 或 .npy",
    "outputs/features/siglip2_so400m_test_features.pt 或 .npy",
    "outputs/features/siglip2_feature_manifest.json"
  ],
  "acceptance_criteria": [
    "训练、验证、测试特征数量分别与对应样本数量完全一致。",
    "manifest 记录每条特征对应的 filepath、filename 或 label 信息，顺序可追溯。",
    "特征张量维度与 SigLIP 2 图像编码器输出维度一致，并写入 manifest。",
    "特征提取在 torch.no_grad() 下执行，模型处于 eval 模式。",
    "支持分批处理，显存不足时可以降低 batch_size 或启用半精度。",
    "重复运行可以检测已有缓存并根据配置选择复用或覆盖。"
  ],
  "depends_on": [
    "005_dataset_loader",
    "010_siglip2_zeroshot"
  ],
  "priority": "required",
  "implementation_notes": [
    "缓存前应确保图像 transform 与 SigLIP 2 processor 一致。",
    "建议同时保存 label_id，避免后续分类头训练再次读取图片。",
    "测试集 manifest 必须保持数字自然序，便于最终提交。",
    "如果存储压力较大，可以使用 float16 缓存特征。"
  ]
}
